project_id,Activity ID,Activity Name,Resource ID,Register Building / Zone Allocation,Drive Activity Dates,BL Start,BL Finish,Start,Finish,Allocation Date,Allocation Ref,Act. Start Status,Act. Finish Status,Original Duration,Actual Duration,Deviated Duration,Budgeted Units,Available units supplied by client vs Actual units of activities,Delayed duration in days due to steel un avilability in site,Remaining Units,Units % Complete,Budgeted Units / Time,Responsibility,Reason for Delay,Responsibility.1,Reason for Delay.1,Note,BL critical Path,BL Longest Path,Updated Critical Path,Updated Longest Path
Sophia-Mall-P.02-UP-26-Jun-26,CON-SM-NW-RFT-1050,RFT for North wing raft RFT (North-Wing),BIG.Q.Rft,North-Wing,Yes,29-Nov-25,11-Dec-25,17-Dec-25,10-Jan-26,11-Nov-25,ALLOC-SM-001,Start,Finished,12,24,12,204.1,177.9,25,0,1.0,17.01,Employer,Free-issue reinforcement steel delivered late against planned need date,Employer,Free-issue reinforcement steel delivered late against planned need date,Fake dataset for dashboard/TIA testing only,Yes,Yes,Yes,Yes
Sophia-Mall-P.02-UP-26-Jun-26,CON-SM-SW-RFT-1060,RFT for South wing columns RFT (South-Wing),BIG.Q.Rft,South-Wing,Yes,13-Dec-25,29-Dec-25,21-Dec-25,18-Jan-26,25-Nov-25,ALLOC-SM-002,Start,Finished,16,28,12,216.0,165.9,18,0,1.0,13.5,Employer,RFI response required before reinforcement closure and inspection,Employer,RFI response required before reinforcement closure and inspection,Fake dataset for dashboard/TIA testing only,Yes,No,No,No
Sophia-Mall-P.02-UP-26-Jun-26,CON-SM-AT-RFT-1070,RFT for Atrium transfer slab RFT (Atrium),BIG.Q.Rft,Atrium,Yes,27-Dec-25,12-Jan-26,20-Jan-26,5-Mar-26,9-Dec-25,ALLOC-SM-003,Start,Finished,16,44,28,200.3,137.3,47,0,1.0,12.52,Engineer,Late payment certification constrained procurement recovery,Engineer,Late payment certification constrained procurement recovery,Fake dataset for dashboard/TIA testing only,No,No,Yes,Yes
Sophia-Mall-P.02-UP-26-Jun-26,CON-SM-CB-RFT-1080,RFT for Cinema block shear wall RFT (Cinema-Block),BIG.Q.Rft,Cinema-Block,Yes,10-Jan-26,20-Jan-26,28-Jan-26,1-Mar-26,23-Dec-25,ALLOC-SM-004,Start,Not Finished,10,32,22,133.2,103.3,35,54.5,0.59,13.32,Engineer,RFI response required before reinforcement closure and inspection,Engineer,RFI response required before reinforcement closure and inspection,Fake dataset for dashboard/TIA testing only,Yes,Yes,Yes,Yes
Sophia-Mall-P.02-UP-26-Jun-26,CON-SM-PP-RFT-1090,RFT for Parking podium slab RFT (Parking-Podium),BIG.Q.Rft,Parking-Podium,Yes,24-Jan-26,3-Feb-26,1-Feb-26,23-Feb-26,6-Jan-26,ALLOC-SM-005,Start,Not Finished,10,22,12,137.7,93.6,18,25.8,0.81,13.77,Employer,IFC/shop drawing conflict delayed release for execution,Employer,IFC/shop drawing conflict delayed release for execution,Fake dataset for dashboard/TIA testing only,No,No,No,No
